{
  "id": "definicion-listo-siniestros",
  "nombre": "Definición de listo en Siniestros",
  "descripcion": "Ninguna historia entra en el sprint de Siniestros sin criterios de aceptación revisados con negocio. El responsable de producto los revisa en el refinamiento y, si faltan, la historia espera al siguiente sprint.",
  "fecha_inicio": "2026-05-04",
  "fecha_fin": null,
  "equipos": [
    "Siniestros"
  ],
  "medidas_objetivo": [
    {
      "medida": "retrabajo",
      "direccion": "bajar"
    }
  ],
  "efecto_esperado": "Retrabajo por debajo del 12% en dos meses.",
  "estado": "en_curso",
  "origen": "retrabajo",
  "evaluacion": null,
  "notas": ""
}
