{
  "id": "limite-wip-canal-digital",
  "nombre": "Límite de trabajo en curso en Canal digital",
  "descripcion": "Canal digital no empieza nada nuevo mientras tenga más tareas en curso que personas (siete). Se ha pactado con el proveedor como parte del servicio y se revisa cada dos semanas.",
  "fecha_inicio": "2026-10-05",
  "fecha_fin": null,
  "equipos": [
    "Canal digital"
  ],
  "medidas_objetivo": [
    {
      "medida": "ciclo",
      "direccion": "bajar"
    }
  ],
  "efecto_esperado": "Plazo un 25% más bajo en dos meses.",
  "estado": "en_curso",
  "origen": "demasiado_a_la_vez",
  "evaluacion": null,
  "notas": ""
}
