{
  "id": "limite-wip-pagos",
  "nombre": "Work in progress limit in Payments",
  "descripcion": "Payments does not start a new task while it has more tasks in progress than people in the team (five). New work waits in the backlog and, in the daily meeting, the team looks first at what can be finished.",
  "fecha_inicio": "2026-06-01",
  "fecha_fin": null,
  "equipos": [
    "Payments"
  ],
  "medidas_objetivo": [
    {
      "medida": "ciclo",
      "direccion": "bajar"
    }
  ],
  "efecto_esperado": "Lead time 30% lower in two months.",
  "estado": "en_curso",
  "origen": "demasiado_a_la_vez",
  "evaluacion": null,
  "notas": ""
}
