{
  "id": "formacion-pruebas-riesgos",
  "nombre": "Automated testing training in Risk",
  "descripcion": "Two automated testing training sessions for Risk and a guide with examples. Every new story has its tests before it goes to review.",
  "fecha_inicio": "2026-06-01",
  "fecha_fin": null,
  "equipos": [
    "Risk"
  ],
  "medidas_objetivo": [
    {
      "medida": "retrabajo",
      "direccion": "bajar"
    }
  ],
  "efecto_esperado": "Rework below 10% in two months.",
  "estado": "en_curso",
  "origen": "retrabajo",
  "evaluacion": null,
  "notas": ""
}
